article link,article headline,article text,date,author,keyword,summary,summary_time_seconds,is_relevant,relevance_score,relevance_label
https://www.dawn.com/news/1968379/soes-an-eclectic-approach,SOEs: an eclectic approach - Dawn,"A CONTROVERSY is raging on both mainstream and social media over PIA’s recentprivatisation. Unless this debate is addressed rationally, future privatisation transactions may also be at risk. Past experience offers a cautionary lesson: the Supreme Court’s decision to annul the privatisation of Pakistan Steel Mills did not revive the enterprise; instead, it led to itsclosurein 2015 and significantly slowed the overall privatisation process.
The popular binary often advanced — either retain enterprises under government ownership or privatise them — is flawed. Decisions regarding state-owned enterprises should be guided by pragmatic considerations rather than ideological preferences. Pakistan has 85 commercial SOEs for diverse purposes across power, oil and gas; transport and communications; manufacturing, mining and engineering; finance; industrial estate development and management; and wholesale and retail trade. Of these, 51 are currently profitable. The argument that profitable SOEs should never be divested is as untenable as the view that all 34 lossmaking entities must be privatised. Neither ownership per se nor current financial performance should solely determine policy.
The basic principle for deciding whether an economic activity should be undertaken by the government — through its departments or through an SOE — rests on two questions: a) does the activity fall within the government’s public policy framework? b) Can it be adequately performed by the private sector?
Relevance to public policy framework:The PPF reflects the government’s development priorities, as articulated in documents such as the Principles of Policy (Article 3 of the Constitution) and sectoral policies relating to agriculture, industry, trade, etc. In assessing alignment with the PPF, it is necessary to consider whether an SOE is connected to one or more core state functions — i) ensuring national food security; ii) developing and managing large-scale infrastructure; iii) national defence and security-related activities; iv) entities established through government-to-government or intergovernmental arrangements; and v) provision of goods and services of critical national economic interest. If an SOE falls into any of these categories, there is a prima facie case for retaining it under government control. The decision then is whether it should be retained in its existing form or restructured to improve performance.
Decisions regarding state-owned enterprises should be guided by pragmatic considerations.
Market failure considerations:The second question concerns market failure: can the private sector adequately deliver the relevant activity? Each SOE must be evaluated in terms of its operations, functions and market structure, with attention to the following: a) is the SOE a natural monopoly; if so, does an effective regulatory framework exist to ensure socially optimal and cost-effective service delivery under private ownership? b) Does the SOE perform a function that generates significant positive externalities and is, therefore, insufficiently profitable for the private sector to undertake? c) Are there alternative delivery mechanisms to achieve the same objectives?
Where market failure prevents the private sector from maximising social welfare, the government has a strong case for retaining control. Even then, competition can be introduced by dismantling monopolies where feasible and establishing strong, independent regulatory agencies.
Financial viability:While several SOEs report accounting profits, financial viability requires more rigorous assessment. The key question is whether the organisation can generate sufficient revenues to cover operating costs, meet debt obligations, and, where relevant, finance investment for growth while maintaining acceptable service standards. The financial viability test should be based on the following: a) Negative shareholders’ equity: Any entity with negative equity for the past three years is financially stressed, as its balance sheet is not bankable and it remains dependent on government guarantees or direct budgetary support. b) Continuous losses: Entities incurring losses over the last three years are similarly stressed, as losses either necessitate government support or gradually erode equity. c) Return on assets: While return on equity is a standard metric, ROA is more appropriate when equity is negative. ROA measures how effectively management uses assets to generate earnings. SOEs with an ROA below five per cent for three consecutive years should be considered financially stressed.
In such cases, financial restructuring is the first step. If restructuring fails under government ownership due to extraneous constraints, alternative options — such as outsourcing, leasing, concession agreements, or transfer of managerial control — should be considered. SOEs that don’t meet public policy criteria, don’t address market failure concerns, or cannot be made viable even after restructuring are prime candidates for privatisation, liquidation, or winding up.
Lessons from successful privatisation:Pakistan’s main privatisation success stories are the banking and telecom sectors. In banking, the share of assets held by nationalised commercial banks declined from around 80pc to about 20pc following privatisation. Prior to 2003, the government injected Rs46 billion to recapitalise lossmaking banks; non-performing loans stood at 25pc, and financial soundness indicators were weak. Since privatisation, four major banks (HBL, UBL, MCB, and ABL) have contributed Rs245bn in corporate taxes in 2024 with cumulative contributions exceeding Rs1.6 trillion since 2004. NPLs have fallen below 7pc, provisioning exceeds 100pc, and overall financial soundness has improved.
The main weakness in recent years is the growing role of banks as public sector financiers, reflected in a declining advance-to-deposit ratio. Importantly, public sector banks such as the NBP and the Bank of Punjab have also improved under a competitive market structure and rank among the top 15 Asia-Pacific banks. The ideological argument that these institutions must also be privatised ignores the empirical evidence that ownership itself is not the decisive factor.
PIA’s case:Applying this framework (spelt out in the SOE Triage Report 2021) to PIA leads to a clear conclusion: there were no compelling public policy or market failure reasons for retaining it under government control. The aviation industry is competitive, and private operators have proved their capacity to perform effectively. Despite repeated restructuring efforts, PIA accumulated losses of Rs850bn. The privatisation objective was not short-term maximisation of sale proceeds but elimination of recurring losses and revival of the airline as an efficient enterprise. Over the longer term, improved performance under private management is expected to generate a steady stream of tax revenues rather than drain the exchequer. In sum, Pakistan needs an eclectic, evidence-based approach to SOEs, which transcends ideological divides and focuses squarely on public policy relevance, market structure, and financial viability.
The writer is a former governor of the State Bank of Pakistan.
Published in Dawn, January 22nd, 2026","Thu, 22 Jan 2026 03:17:26 GMT",,direct taxes FBR,"Decisions regarding state-owned enterprises should be guided by pragmatic considerations rather than ideological preferences. Pakistan has 85 commercial SOEs for diverse purposes across power, oil and gas. The question is whether the state can provide a service that is cost-effective.",5.074463844299316,True,0.12529796361923218,sales tax and indirect taxation
https://www.dawn.com/news/1968546,Nestle plans $60m business expansion - Dawn,"ISLAMABAD: Nestle, the multinational food and beverage company, on Thursday announced an additional $60 million investment in Pakistan during a roundtable discussion on the sidelines of the World Economic Forum (WEF) in Davos.
Finance Minister Muhammad Aurangzeb chaired the business round-table, bringing together CEOs and senior leaders of leading global corporations to discuss Pakistan’s reform trajectory, investment climate, and long-term growth potential.
The announcement of additional investment was made by Nestle’s Executive Vice-President and Chief Executive Officer for Asia, Oceania and Africa, Remy Ejel, said a press release issued by the finance ministry.
He said that Nestle would undertake a robust expansion of its operations, reaffirming its long-term commitment to Pakistan.
The roundtable was part of the government’s ongoing engagement with multinational investors to promote policy predictability, economic formalisation, and sustainable, export-oriented growth, the press release added.
Mr Ejel further annou­nced that Nestle intends to use Pakistan as a regional manufacturing hub to export products to 26 countries. Expressing stro­ng confidence in the economic outlook, he foresaw robust business growth in the coming years.
The announcement builds on Nestle’s recent engagement with the finance minister in Islamabad, where the company had outlined its strategy centred on localisation, advanced manufacturing, sustainability, and agricultural transformation.
Nestle has made significant progress in technology-driven manufacturing, with highly automated facilities, expanded use of renewable energy, improved packaging solutions, and digitalised supply chains, strengthening efficiency while reducing environmental impact.
Mr Ejel highlighted Nestle’s global scale as one of the world’s leading food, beverage, nutrition, and health companies, with operations in over 180 countries, a workforce exceeding 277,000 employees, and global revenues of approximately $114.25 billion in 2025.
He noted that Pakistan’s demographic profile, growing nutrition needs, and underpenetrated value-added food segments closely mirror successful growth trajectories seen in Southeast Asia.
Welcoming Nestle’s investment announcement, Senator Muhammad Aurangzeb described it as a strong vote of confidence in Pakistan’s economic reforms and formalisation drive.
He reaffirmed the government’s commitment to strengthening the tax ecosystem, ensuring policy consistency, and facilitating responsible long-term investment through continued engagement with the private sector, including via the Tax Policy Office established within the Finance Division.
Published in Dawn, January 23rd, 2026","Fri, 23 Jan 2026 02:45:13 GMT",,corporate tax Pakistan,"Nestle announces $60 million investment in Pakistan. The announcement was made during a roundtable discussion on the sidelines of the World Economic Forum. Senator Muhammad Aurangzeb described it as a strong vote of confidence in Pakistan’s economic reforms and formalisation drive. He reaffirmed the government's commitment to strengthening the tax ecosystem, ensuring",2.2014567852020264,False,0.1313920021057129,entertainment and celebrity news
https://www.dawn.com/news/1968435,"Nestle announces $60m additional investment in Pakistan, to expand operations in country - Dawn",,"Thu, 22 Jan 2026 11:54:08 GMT",,corporate tax Pakistan,In this article we look at some of the most important figures in the history of medicine. We also look at the role of medicine in the creation of the modern world. This article is based on a report by the International Institute of Public Health Research.,1.5798590183258057,True,0.1769740879535675,sales tax and indirect taxation
https://www.dawn.com/news/1968559,Democracy & capitalism’s shadow - Dawn,"“THE top 10% own three-quarters of global wealth, while the bottom half holds only 2%.” So states the World Inequality Report 2026. Can democracy survive when capitalism concentrates wealth so drastically?
The belief that democracy and capitalism are natural allies is as widespread as it is inaccurate. To see this, one has only to observe capitalist accumulation under authoritarian political arrangements. The UAE is just one such example. Why then does this belief persist?
Democracy and capitalism often journey together — until they don’t. To a point, they do support each other. This is why it is not easy to find democracies without capitalism. Think of a society, poor and authoritarian, that then undergoes a revolutionary change that makes it both democratic and capitalist. For a while, the two wo­­uld go together. Democracy would bring freedom and political equality; capitalism would bring resources.
Even Marx acknowledged that capitalism creates ‘colossal productive forces’. The growing middle class would demand greater freedoms and consumption, thereby strengthening both democracy and capitalism. For some time, prosperity and empowerment would rise together.
But this harmonious co-existence would soon wear off. Democracy is about political equality. Capitalism, by design, needs economic inequality. The two would eventually collide. In time, the wealth generated by capitalism starts to pool in fewer and fewer pockets. Growth continues, distribution falters. Tensions begin to appear.
Democracy is about political equality. Capitalism, by design, needs economic inequality.
This concentration is not just financial. Being rich doesn’t just mean plush houses or private jets. It means connections and information, as the wealthy form exclusive social ties, venture together, share insights and tastes, thus increasing their collective purse. French sociologist Bourdieu has called this social capital, “aggregate of actual or potential resources” that bring tangible benefits. High-profile events such as the Ambani wedding illustrate how this transformation happens. But the process does not stop here.
Social capital soon becomes political capital, with the wealthy getting access to the political class, who make laws. The role of the corporate lobby and campaign funding is well documented. These are some of the ways in which wealth buys political influence. Elon Musk’s access to and authority in the White House was an example of the political power wealth can bring. Consequently, economic values of capitalism start to prevail over the political ideals of democracy, human rights and political equality, as the market dictates the state.
We have drifted far away from the attractive capitalist rhetoric of riches through hard work and entrepreneurship. Now, wealth generates wealth, creating inequalities not justifiable through merit. That inequality is endemic to capitalism and not just an irritating bug, is well shown by Thomas Piketty, who demonstrated that the return on capital (rent) grows faster than the return on labour (income). Proponents of capitalism may insist that inequality brings growth but such justifications ring hollow when wealth buys disproportionate political influence.
One would expect that, in a democracy, as people realise the asymmetry of wealth distribution they feel relatively poorer, and experience alienation in economic and political spheres, they would vote against such a system, demand reforms, regulatory constraints and a redirection. In theory, democracy should prevent capitalism from reaching its logical outcome of concentrating wealth among a small elite. Yet that concentration of wealth is exactly what has been happening. Why?
When people suffer, they seek an explanation. Here, the narratives people have to make sense of their condition become important. There is a leftist narrative, including democratic socialism, which explains the alienation through a critique of capitalism, giving an economic explanation. But there is very little space for such narratives in school curricula or on the mainstream media. Instead, two other narratives prevail as they are pushed through by the mostly corporate-owned media. It is not an accident that some of the most powerful media outlets today — both conventional and social — are owned by billionaires or corporations.
The liberal media supports capitalism, insisting on its necessity for democracy. It projects billionaires as self-made, implying anyone can succeed. In the process, the role of inheritance, connections, tax evasion, low wages and corporate welfare is pushed under the carpet. The poor are blamed for their condition, as if it has nothing to do with systemic biases, inequitable access to education and capital or with historical injustices. This narrative claims capitalism as a bastion of innovation but sidelines the fact that only those advancements that bring profit are allowed, not those that genuinely improve human life. This glamorised but distorted storyline leaves people stuck between conviction (that they can make it) and anxiety (that they cannot).
The right-wing — and increasingly even sections of liberal — media weaponise panic and resentment against migrants, selected racial and religious groups, and unconventional identities by whispering that these ‘unwashed’ have stolen the wealth of the suffering workers. In time, these narratives cleverly divert the anger and distress resulting from capitalistic alienation towards oneself, fuelling an epidemic of mental illness, or towards creating scapegoats — while sparing capitalism and its contradictions. Unsurprisingly, a recent survey in the US showed that only 52pc of the least financially secure thought democracy was the best form of government; those who need it the most trust it the least. This misdirected rage is visible in many countries today, particularly in the US, UK and India.
To conclude, democracy and capitalism may begin as partners but soon the relationship turns antagonistic. Capital, with its material resources, seeks to break any restraints on it. Those who want both democracy and capitalism must build bulwarks — a social contract that curbs wealth concentration and ensures public ownership of sectors, education and health in particular — crucial for equality of opportunities. A critical political education of citizens, young and old, is also needed so that they do not fall for destructive narratives and are not diverted from the real causes of malaise. If democracy is to endure, it must tame capitalism, not merely coexist with it.
The writer is dean, Institute for Educational Development, Aga Khan University.
Published in Dawn, January 23rd, 2026","Fri, 23 Jan 2026 03:01:13 GMT",,corporate tax Pakistan,"The belief that democracy and capitalism are natural allies is as widespread as it is inaccurate. Social capital soon becomes political capital, with the wealthy getting access to the political class, who make laws. If democracy is to endure, it must tame capitalism, not merely coexist with it.",5.398352861404419,True,0.13388894498348236,tax to GDP ratio
https://www.dawn.com/news/1968353/equities-falter-after-record-setting-spell-at-psx,Equities falter after record-setting spell at PSX - Dawn,,"Thu, 22 Jan 2026 02:41:28 GMT",,corporate tax Pakistan,In this article we look at some of the most important figures in the history of medicine. We also look at the role of medicine in the creation of the modern world. This article is based on a report by the International Institute of Public Health Research.,1.5692939758300781,False,0.14377781748771667,sports and games
https://www.dawn.com/news/1968321/cjp-reviews-progress-on-reforms,CJP reviews progress on reforms - Dawn,,"Thu, 22 Jan 2026 01:39:00 GMT",,FBR reform,In this article we look at some of the most important figures in the history of medicine. We also look at the role of medicine in the creation of the modern world. This article is based on a report by the International Institute of Public Health Research.,1.586535930633545,True,0.1454072743654251,sales tax and indirect taxation
https://epaper.dawn.com/DetailNews.php?StoryText=21_01_2026_001_006,"Jan 21, 2026 | Raja Nasir finally declared Senate opposition leader - Dawn",,"Tue, 20 Jan 2026 19:00:00 GMT",,FBR reform,In this article we look at some of the most important figures in the history of medicine. We also look at the role of medicine in the creation of the modern world. This article is based on a report by the International Institute of Public Health Research.,1.6119492053985596,True,0.15103872120380402,sales tax and indirect taxation
https://www.dawn.com/news/1963309,FBR cracks down on healthcare tax evasion - Dawn,"ISLAMABAD: The Federal Board of Revenue (FBR) has intensified its enforcement drive across the country against tax evasion in the private healthcare sector by placing Inland Revenue Service (IRS) officers directly at the premises of commercial hospitals and clinics, senior tax officials toldDawnon Thursday.
The move marks a shift toward on-site monitoring as authorities seek to curb underreporting of taxable income in one of the country’s most lucrative professional sectors. The initiative gained mom­entum in the wake of the poor tax compliance of doctors in the tax year 2025.
Official figures compiled by the FBR show that a large share of Pakistan’s medical profession remains outside the tax net, while a minimal number of those on the tax rolls declared extremely low annual incomes in their tax returns for TY2025.
Of the 319,572 registered doctors nationwide, only 130,243 are registered on the income tax rolls, representing 40.75 per cent of the total. Even within this already narrow base, just 56,267 doctors filed income tax returns for TY2025, only 43.20pc of those exist on tax rolls with the tax authorities, placing the profession among the least compliant sectors in the tax system.
Moreover, even among those who filed tax returns, income declarations point to widespread underreporting, raising questions about enforcement, transparency, and the credibility of declared earnings within one of the country’s most established and high earning professions.
Officers deputed at private hospitals to monitor revenue and ensure tax compliance
A senior tax official toldDawnthat the FBR has begun deploying IRS officers directly at the premises of commercial entities, including private hospitals and clinics, to strengthen monitoring and enforcement. According to the official, these officers are tasked with observing the provision of medical services and the collection of receipts in real time.
In the first phase, officers have been posted at 50 commercial hospitals under Section175-C of the Income Tax Ordinance. The objective is to identify underreporting of revenues, particularly from high inpatient occupancy charges that, in some cases, exceed the rates charged by five star hotels.
“We will identify non-compliant doctors through this exercise,” the official said, adding that private notices are being issued to encourage voluntary compliance. The official noted that voluntary compliance from doctors has already begun following the issuance of these notices.
The data place the number of registered doctors on the tax rolls at 130,243, of whom 56,287 filed income tax returns in TY2025, about 43pc of those registered. Among the filers, 48,704 doctors declared income, representing roughly 87pc of those who submitted returns.
Official figures showed that only around two in five registered doctors filed income tax returns in TY2025, with an even smaller share reporting taxable income.
However, 7,583 doctors reported zero income in their tax returns for TY2025.
Further analysis of the returns showed that 30,000 doctors of the 48,704 doctors have declared less than Rs2 million annual income, which accounted for 61.59pc of all doctors who declared taxable income in their returns. This percentage goes to 65 percent of total return filers, who declared less than Rs2 million annual income.
Moreover, most doctors fall in the lower reported income brackets.
Within the below Rs2m income bracket, the breakdown of tax returns declarations further highlights the scale of low declared earnings.
As many as 341 doctors reported annual income between Re1 and Rs100,000 in their returns, 17,647 doctors declared income ranging from Rs100,000 to Rs1m, while 12,959 reported annual earnings between Rs1m and Rs2m for TY2025.
According to data, a sharp decline in the number of doctors as income levels rise. The data show 6,655 doctors fall within the Rs2m to Rs3m annual income bracket, 6,959 doctors are in the Rs3m to Rs5m range, and 3,093 doctors declared annual income between Rs5m and Rs10m.
At the highest end of the scale, only 1,050 doctors declared annual income exceeding Rs10m in TY2025.According to the FBR, statistics highlight two gaps, first between registered doctors and those filing their tax returns, and second between filers and the income levels declared with the largest concentration of declarations below Rs2m per year in TY2025.
Published in Dawn, December 26th, 2025","Fri, 26 Dec 2025 08:00:00 GMT",,tax evasion crackdown,"Only around two in five registered doctors filed income tax returns in TY2025. At the highest end of the scale, only 1,050 doctors declared annual income exceeding Rs10m. The move marks a shift toward on-site monitoring as authorities seek to curb underreporting.",4.363051176071167,True,0.5648735165596008,tax evasion and enforcement
