article link,article headline,article text,date,author,keyword,summary,summary_time_seconds,is_relevant,relevance_score,relevance_label
https://www.dawn.com/news/1968167,"PML-N senator sees officials’ hand in Nadra, FBR data leak - Dawn","• Senator Afnanullah Khan claims up-to-date datasets are available on ‘dark web’• Committee chair suggests banning social media platforms who do not cooperate when asked to take down ‘terrorist accounts’
ISLAMABAD: A lawmaker from the ruling PML-N claimed on Tuesday that there had to be some officials connivance at play, as he highlighted the theft of Pakistanis’ personal data, saying that it was available on the dark web.
Senator Afnanullah Khan made the remarks during a meeting of the Senate Standing Com­mittee on Interior.
“It is the latest data… and it is such good data that we might not have such well-processed data. For example, they have consolidated data from the National Database and Registration Autho­rity (Nadra), the Federal Board of Revenue (FBR) and banks in a dataset,” he said.
“And you can get anyone’s data for Rs500, and if you want that of the entire country, you will get it for Rs70-80 billion. Data worth Rs70-80bn is [available] on the dark web,” the senator said.
The dark web refers to websites that are not indexed by search engi­nes, and are usually encry­pted, only accessible through specialised browsers. This heightened anonymity makes it a hotbed for illegal activities, such as drug and/or arms sales, fraud and data theft etc.
Senator Afnanullah pointed out that when the data of any individual was stolen, it could be used for any purpose, including obtaining passports and identity cards for others.
“Why is Pakistanis’ data stolen time and again?” he asked.
Addressing Mustafa Jamal Kazi of the Directorate General of Immigration and Passports, he added: “Let me tell you one thing; without the [involvement of] people inside the organisation, data theft at such a large scale is not possible. It is impossible. The data of 240 million people cannot be stolen just like that.”
Later, speaking to Dawn, the PML-N senator asserted that this data could not have been leaked without the involvement of officials in the Nadra and Immig­ration and Passports Directorate General.
In the meeting, Committee Cha­i­r­person and PTI Senator Faisal Saleem Rahman had asked Mr Kazi whether any investigation had been carried out in this regard.
Mr Kazi responded that a probe had been conducted and officials had also been removed.
Senator Rahman also stressed the need for ensuring the protection of law enforcement bodies’data. “Who will be responsible if their data is leaked?” he said.
Proposal to ban social media platforms
Minister of State for Interior Talal Chaudhry also attended the meeting, and raised the issue of the use of social media by terrorists.
“Previously, terrorists used guns. Now, they are using social media,” he said, adding that social media companies would not even share the internet protocol addresses of users operating accounts being used for terrorism.
Speaking on the matter, Senator Rahman suggested that the government should enter into a contract with social media platforms. He further advised that platforms that did not cooperate with the government should be banned.
PPP Senator Palwasha Khan endorsed these views, saying: “A ban should definitely be imposed.”
Senator Rahman further pointed out that China had its own social media platforms and said, “There is no need to employ the services of those [companies] that are not cooperating.”
Chaudhry responded to the suggestion, saying: “This is a big decision, you can take it. If we take it, it will be called an attack on the freedom of expression.”
Published in Dawn, January 21st, 2026","Wed, 21 Jan 2026 01:37:18 GMT",,FBR revenue collection,"Senator Afnanullah Khan made the remarks during a meeting of the Senate Standing Com­mittee on Interior. “You can get anyone’s data for Rs500, and if you Senator Faisal Saleem Rahman also stressed the need for ensuring the protection of law enforcement bodies’data. He suggested that platforms that did not cooperate with the government should be banned.",2.866276979446411,True,0.169931560754776,tax revenue collection
https://www.dawn.com/news/1968054,‘Not possible without officials’ involvement’: PML-N senator on theft of Pakistanis’ data - Dawn,,"Tue, 20 Jan 2026 13:35:29 GMT",,FBR revenue collection,In this article we look at some of the most important figures in the history of medicine. We also look at the role of medicine in the creation of the modern world. This article is based on a report by the International Institute of Public Health Research.,2.6630008220672607,True,0.18254077434539795,sales tax and indirect taxation
https://www.dawn.com/news/1967972,JazzWorld locks Rs75bn swap deal with UBL - Dawn,,"Tue, 20 Jan 2026 02:21:07 GMT",,FBR revenue collection,In this article we look at some of the most important figures in the history of medicine. We also look at the role of medicine in the creation of the modern world. This article is based on a report by the International Institute of Public Health Research.,1.5616810321807861,False,0.07844928652048111,sports and games
https://www.dawn.com/news/1964795,Aurangzeb lauds FBR for record tax collection - Dawn,,"Sat, 03 Jan 2026 08:00:00 GMT",,FBR revenue collection,In this article we look at some of the most important figures in the history of medicine. We also look at the role of medicine in the creation of the modern world. This article is based on a report by the International Institute of Public Health Research.,1.6569209098815918,True,0.9123553037643433,tax revenue collection
https://www.dawn.com/news/1964382,Collection falls short by Rs331bn in July-December - Dawn,,"Thu, 01 Jan 2026 08:00:00 GMT",,FBR revenue collection,In this article we look at some of the most important figures in the history of medicine. We also look at the role of medicine in the creation of the modern world. This article is based on a report by the International Institute of Public Health Research.,1.6864840984344482,True,0.256123811006546,tax revenue collection
https://www.dawn.com/news/1968355,Fitch affirms Pakistan’s debt ratings at ‘B-’ - Dawn,,"Thu, 22 Jan 2026 02:55:38 GMT",,tax revenue Pakistan,In this article we look at some of the most important figures in the history of medicine. We also look at the role of medicine in the creation of the modern world. This article is based on a report by the International Institute of Public Health Research.,1.65159010887146,True,0.1820433884859085,sales tax and indirect taxation
https://www.dawn.com/news/1968585/mnas-and-tax-returns,MNAs and tax returns - Dawn,,"Fri, 23 Jan 2026 03:27:19 GMT",,income tax collection Pakistan,In this article we look at some of the most important figures in the history of medicine. We also look at the role of medicine in the creation of the modern world. This article is based on a report by the International Institute of Public Health Research.,1.6740400791168213,True,0.6889840960502625,tax revenue collection
https://www.dawn.com/news/1968540,Used phone rates to fall as govt revisits valuation - Dawn,"• Ruling covers 62 models across Apple, Samsung, Google Pixel, OnePlus• iPhones see steepest cuts • Values apply regardless of condition; accessories not included• Phones must be activated six months before import
ISLAMABAD: As mobile phone prices remain elevated for new buyers due to higher assessed values, the Customs Valuation Department has reduced assessment rates for duties and taxes on the commercial import of used and old mobile phone sets to ease pressure on consumers in the used smartphone market.
At the same time, fresh assessment values have been set for high-end used iPhone models, ranging from the iPhone 14 and its variants to the iPhone 15 series. For Samsung, Google Pixel and OnePlus, the assessed rates have largely been left unchanged or fixed for the first time.
The revised rates were notified through Valuation Ruling No. 2035 of 2026, which will come into effect from Jan 16, 2026.
Customs officials said the revision reflects a decline in international prices of older smartphones, particularly iPhones, as these devices approach the end of their commercial life cycle.
The downward adjustment, they added, is intended to align valuations with market rates and ensure the benefit is passed on to end consumers through lower duties and, potentially, lower retail prices.
Officials said the new ruling covers 62 mobile phone models across four leading brands, either through revised values or first-time valuation. They said the methodology relied on market inquiries, benchmarked against trade-in prices published on the official websites of manufacturers, including Samsung, Google and OnePlus.
The government levies multiple charges on mobile phones, including a flat Rs250 per set, 18 per cent sales tax, withholding tax, a handset levy and regulatory duties. These are calculated on the notified assessed value of each handset.
A comparison of values notified for 2026 with those issued in 2024 shows a sharp reduction in assessed values for used phones. Used iPhones recorded the steepest cuts, with declines ranging from 32pc to 81pc.
Among the biggest revisions, the assessed value of the iPhone 12 Pro fell to $155 from $280, while the iPhone 12 Pro Max was reduced to $215 from $340.
The iPhone 13 was cut to $170 from $280, the iPhone 11 Pro Max to $145 from $245, and the iPhone XS Max to $95 from $150. The iPhone X was lowered to $57 from $75.
Even newer flagship models were revised downwards, with the iPhone 13 Pro Max reduced to $295 from $430, and the iPhone 13 Pro to $225 from $360.
The department also fixed assessment values for seven newer used iPhone models. Under the new rates, the iPhone 15 Pro Max has been valued at $460, the iPhone 15 Pro at $390, the iPhone 15 Plus at $320, and the iPhone 15 at $310.
For the iPhone 14 lineup, the iPhone 14 Pro Max has been assessed at $360, the iPhone 14 Pro at $290, and the iPhone 14 at $210.
Samsung, Google, OnePlus
By contrast, valuations for other major brands were largely unchanged. Only a marginal adjustment was recorded for the Samsung Galaxy S23 Ultra, which was assessed at $255, reflecting a modest decline.
Other Samsung models were valued at lower but steady levels, with the Galaxy S23 Plus assessed at $160, the Galaxy S23 at $140, and the Galaxy S22 Ultra 5G at $160. Older models included the Galaxy S21 Plus 5G at $69, the Galaxy S21 5G at $50, the Galaxy S20 Plus at $46, and the Galaxy S20 at $41.
For Google Pixel devices, the ruling fixed values across newer and older models, including the Pixel 9 Pro XL at $260, the Pixel 9 Pro at $195, and the Pixel 9 at $150. The Pixel 8 Pro was valued at $188 and the Pixel 8 at $98.
A similar pattern was reported for OnePlus phones, with the OnePlus 12 assessed at $184 and the OnePlus 12R at $105, while older models were valued at $92 for the OnePlus 11, $65 for the OnePlus 10 Pro, and $60 for the OnePlus 10T.
According to the ruling, the notified values will apply to used mobile phones imported in commercial quantities without packaging and accessories, and will form the basis for the assessment of duties and taxes at the time of import. The values will apply regardless of the specific grade or condition of the phones.
It further stipulates that devices must have been activated at least six months prior to export to Pakistan. Importers will be required to declare the activation period, which will be verified by assessing officers during clearance.
Customs officials said the Directorate General of Customs Valuation held consultations with stakeholders on Aug 12, Sept 26 and Dec 15 last year. Import data covering a 90-day period was collected and analysed, while market inquiries were carried out to determine revised values.
For brands and models imported commercially but not listed in the ruling, importers have been advised to determine assessable values under Sections 25(5) and 25(6) of the Customs Act, 1969.
Published in Dawn, January 23rd, 2026","Fri, 23 Jan 2026 00:43:06 GMT",,income tax collection Pakistan,"Customs Valuation Department has reduced assessment rates for duties and taxes on the commercial import of used and old mobile phone sets. Ruling covers 62 models across Apple, Samsung and Google. Device must have been activated at least six months prior to export.",4.500319004058838,True,0.4010436534881592,tax reform and policy
https://www.dawn.com/news/1968758/from-the-past-pages-of-dawn-1976-fifty-years-ago-tax-recovery-campaign,From The Past Pages Of Dawn: 1976: Fifty Years Ago: Tax recovery campaign - Dawn,,"Sat, 24 Jan 2026 01:03:57 GMT",,income tax collection Pakistan,In this article we look at some of the most important figures in the history of medicine. We also look at the role of medicine in the creation of the modern world. This article is based on a report by the International Institute of Public Health Research.,1.4471580982208252,True,0.8919402360916138,tax revenue collection
https://www.dawn.com/news/1968521,PTI seeks withdrawal of asset secrecy bill - Dawn,"ISLAMABAD: PTI MNA Asad Qaiser, while speaking in the National Assembly on Thursday, raised objections to the bill ensuring the secrecy of lawmakers’ assetspasseda day earlier, saying parliamentarians were not above ordinary citizens. He announced PTI’s dissociation from the bill and sought its withdrawal.
Under Section 137 of the Elections Act, all members of parliament and provincial assemblies are required to submit to the Election Commission of Pakistan (ECP), on or before Dec 31 each year, a statement of their assets and liabilities, including those of their spouses and dependent children. Section 138 of the Act requires the ECP to publish these declarations in the official gazette.
The proposed amendment to Section 138 seeks to insert a proviso stating: “Provided that the Speaker of the concerned Assembly or, as the case may be, the Chairman of the Senate may, on an application made by a member and for reasons to be recorded in writing, by a ruling delivered in the chamber, determine that the statement of assets and liabilities of that member shall not be published publicly by the Commission if such publication would pose a serious threat to the life or safety of the member or, as the case may be, his family, for a period not exceeding one year at a time and subject to the condition that a complete and true statement of assets and liabilities shall be submitted confidentially to the Election Commission.”
Tax bill
On Thursday, the House also passed the Income Tax Third Amendment Bill 2025, moved by Minister of State for Finance Bilal Azhar Kayani, who said it aimed to safeguard taxpayers’ rights and strengthen the Alternate Dispute Resolution Com­mittee.
NA passes Income Tax Third Amendment Bill
The National Assembly was informed that billions of dollars in investment had been attracted through the Special Investment Facilitation Council (SIFC). Parliamentary Affairs Minister Tariq Fazal Chaudhry said investments had come across multiple sectors, supported by initiatives such as the investment policy and revised visa policy. Minister of State Bilal Azhar Kayani added that the SIFC functioned as a single window to promote investment and transparency.
Furthermore, seven new bills were laid before the assembly for consideration. These included the National Anti-Money Laundering and Counter Financing of Terrorism Authority Bill, the National Archives Amendment Bill, 2026, and the Abandoned Properties Management Amendment Bill, 2026.
With additional input from APP
Published in Dawn, January 23rd, 2026","Fri, 23 Jan 2026 00:43:12 GMT",,income tax collection Pakistan,Asad Qaiser raised objections to the bill ensuring the secrecy of lawmakers’ assets. He announced PTI’s dissociation from the bill and sought its withdrawal. The House also Seven new bills were laid before the assembly for consideration. Minister of State Bilal Azhar Kayani added that the SIFC functioned as a single window to promote investment.,2.469698905944824,True,0.1548805832862854,tax reform and policy
https://www.dawn.com/news/1968549,"Sustainable growth key to economic transformation, says minister - Dawn",,"Fri, 23 Jan 2026 02:47:10 GMT",,income tax collection Pakistan,In this article we look at some of the most important figures in the history of medicine. We also look at the role of medicine in the creation of the modern world. This article is based on a report by the International Institute of Public Health Research.,1.5534169673919678,True,0.16943363845348358,sales tax and indirect taxation
https://www.dawn.com/news/1967697,Pakistan’s exchange rate illusion - Dawn,"The exchange rate is a critical economic variable for Pakistan. A competitive and credible currency regime should form the core of the nation’s economic strategy, particularly given the country’s dependence on foreign exchange for growth.
Unfortunately, Pakistan has repeatedly used the exchange rate as a short-term stabilisation tool, often holding it at levels that favour political convenience rather than economic fundamentals. Once reserves are depleted, this approach has led to abrupt and disruptive corrections consistently undermining rather than enhancing export potential.
That said, it is incredibly important to have a competitive exchange rate as it improves export margins, encourages investment in tradable goods, and signals the viability of producing for global markets.
History shows that prolonged artificial stability acts as a tax on exports and a subsidy to imports
However, rate alone is insufficient; credibility is equally essential. Exporters are willing to invest and scale up operations only if they trust that relative prices will remain broadly aligned with fundamentals over time. In Pakistan’s case, this trust has been repeatedly eroded.
The Musharraf era
During the Musharraf administration, the rupee was kept stable at around Rs60 to the dollar throughout much of the 2000s. While this stability created an illusion of macroeconomic soundness, it concealed growing external imbalances.
When the pressures finally surfaced, the adjustment was late and severe: from 2007 to 2009, the rupee dropped from roughly Rs60 to over Rs80 per dollar as reserves collapsed and an International Monetary Fund intervention became necessary. Exporters, who had operated under an overvalued currency, did not suddenly become competitive. Instead, they faced higher input costs, disrupted financing, and weakened financial positions.
Stability over fundamentals
The above pattern recurred between 2013 and 2017, with the rupee held between Rs100–105 per dollar despite widening current-account deficits and falling reserves. Exporters consistently warned about the currency’s overvaluation, but policy makers focused on maintaining price stability and political optics. When the inevitable adjustment occurred, it was abrupt and disorderly: the rupee’s value dropped sharply in mid-2017, followed by a larger correction after 2018, reaching around Rs160 per dollar by mid-2019. This sudden realignment destabilised firms and inflation expectations instead of supporting a smooth transition.
Market distortions and eroding confidence
The last three years have proven even more damaging. Administrative controls, delayed adjustments, and the emergence of multiple exchange rates pushed pressure into informal markets.
In early 2023, the rupee experienced one of its steepest single-day falls, losing nearly 10 per cent within hours. Over the year, it depreciated by close to 30pc percent, at one point briefly approaching Rs300 per dollar before settling near Rs285 when administrative controls were introduced.
These shifts coincided with harsh stabilisation measures such as import compression, punitive interest rates, higher energy prices, and increased taxes. Any potential export gains from depreciation were negated by rising costs and collapsing confidence.
Repeatedly underminig exports
These episodes highlight a clear lesson: prolonged artificial stability acts as a tax onexportsand a subsidy to imports. This encourages consumption and rent-seeking while discouraging investment in tradable sectors. When adjustment is finally forced, it comes as a crisis — too sudden and volatile to generate the intended export response. Exporters cannot recover lost markets overnight, nor can they invest amidst uncertainty and tightening financial conditions.
Gradual adjustment and integrated policy
Successful export economies do not rely on dramatic devaluations. Instead, they allow gradual, market-aligned adjustments, avoid prolonged misalignments, and resist using the exchange rate as a political tool. Effective currency policy is complemented by competitive energy pricing, predictable taxation, efficient logistics, and skills development, enabling exporters to respond to price signals.
For example, Vietnam has pursued gradual adjustments that avoid prolonged overvaluation and limit volatility, giving exporters the confidence to invest and integrate into global value chains. Bangladesh has similarly adopted a steady crawl rather than crisis-driven devaluations, preserving export competitiveness and market share — a model Pakistan has repeatedly failed to emulate.
Conclusion: toward a credible exchange rate policy
Pakistan’s core issue is not deciding between a ‘strong’ or ‘weak’ rupee. Rather, it is the persistent belief that administrative controls can substitute for competitiveness. Until the exchange-rate policy reflects fundamentals on a sustained basis and is part of a broader, credible export strategy, depreciation will remain disruptive, and exports will continue to be vulnerable to future crises.
The writer, a former CEO of Unilever Pakistan and of the Pakistan Business Council, serves on the boards of several public companies.
Published in Dawn, The Business and Finance Weekly, January 19th, 2026","Mon, 19 Jan 2026 01:22:42 GMT",,income tax collection Pakistan,"Pakistan has repeatedly used the exchange rate as a short-term stabilisation. In early 2023, the rupee experienced one of its steepest single-day falls, losing nearly 10 per cent within hours. Pakistan’s core issue is not deciding between a ‘strong’ or ‘weak’ rupee.",4.853937864303589,False,0.1174808070063591,entertainment and celebrity news
