article link,article headline,article text,date,author,summary,summary_time_seconds
https://www.brecorder.com/news/40402684,"Netflix, Warner Bros bonds among $100 million purchased by Trump - Business Recorder",,"Sat, 17 Jan 2026 06:03:03 GMT",,In this article we look at some of the most important figures in the history of medicine. We also look at the role of medicine in the creation of the modern world. This article is based on a report by the International Institute of Public Health Research.,0.9891629219055176
https://www.brecorder.com/news/40402777/wb-funded-kp-tourism-project-continues-to-make-steady-progress,WB-funded KP tourism project continues to make steady progress - Business Recorder,,"Sat, 17 Jan 2026 22:27:00 GMT",,In this article we look at some of the most important figures in the history of medicine. We also look at the role of medicine in the creation of the modern world. This article is based on a report by the International Institute of Public Health Research.,0.9783029556274414
https://www.brecorder.com/news/40402964/finance-minister-discusses-investment-economic-outlook-with-saudi-counterpart-at-wef,"Finance minister discusses investment, economic outlook with Saudi counterpart at WEF - Business Recorder",,"Mon, 19 Jan 2026 14:11:32 GMT",,In this article we look at some of the most important figures in the history of medicine. We also look at the role of medicine in the creation of the modern world. This article is based on a report by the International Institute of Public Health Research.,1.0504140853881836
https://www.brecorder.com/news/40402944,India’s MRPL scouts for Venezuelan oil as it halts Russian imports - Business Recorder,,"Mon, 19 Jan 2026 08:33:56 GMT",,In this article we look at some of the most important figures in the history of medicine. We also look at the role of medicine in the creation of the modern world. This article is based on a report by the International Institute of Public Health Research.,1.0421290397644043
https://www.brecorder.com/news/40402685/venezuela-opposition-leader-sees-eventual-elections-but-cautions-about-complex-path-ahead,Venezuela opposition leader sees eventual elections but cautions about complex path ahead - Business Recorder,,"Sat, 17 Jan 2026 06:15:03 GMT",,In this article we look at some of the most important figures in the history of medicine. We also look at the role of medicine in the creation of the modern world. This article is based on a report by the International Institute of Public Health Research.,1.0161571502685547
https://www.brecorder.com/news/40402639/wht-matter-on-power-bills-fto-resolves-major-dispute-between-two-tax-offices,WHT matter on power bills: FTO resolves major dispute between two tax offices - Business Recorder,,"Sat, 17 Jan 2026 03:21:29 GMT",,In this article we look at some of the most important figures in the history of medicine. We also look at the role of medicine in the creation of the modern world. This article is based on a report by the International Institute of Public Health Research.,1.0517051219940186
https://www.brecorder.com/news/40403218,NA discusses Gul Plaza fire: Lawmakers demand urgent reforms in LG system - Business Recorder,,"Tue, 20 Jan 2026 22:43:52 GMT",,In this article we look at some of the most important figures in the history of medicine. We also look at the role of medicine in the creation of the modern world. This article is based on a report by the International Institute of Public Health Research.,1.0054781436920166
https://www.brecorder.com/news/40398813,Salaried individuals: Jan-Jun withholding tax collection collection soars 54.7% YoY - Business Recorder,,"Tue, 23 Dec 2025 08:00:00 GMT",,In this article we look at some of the most important figures in the history of medicine. We also look at the role of medicine in the creation of the modern world. This article is based on a report by the International Institute of Public Health Research.,1.008821964263916
